{
  "schema_version": 1,
  "catalog_id": "github-provider-public-exposure-v1",
  "provider": "github.com",
  "lifecycle": {
    "status": "superseded",
    "deploy_authority": false,
    "replacement": "config/github-launch-audit-v1.schema.json",
    "reason": "The historical 31-surface catalog and its uniform four-lane evidence model are retained only as migration context; they are not a launch or deployment authority."
  },
  "required_surfaces": [
    { "id": "git-objects-and-all-refs", "provider_surface": "All Git objects and refs", "public_visibility": "public", "anonymous_probe_required": true, "derived_bytes_required": true, "lifecycle": "superseded" },
    { "id": "branches", "provider_surface": "Branches and protection-visible metadata", "public_visibility": "public", "anonymous_probe_required": true, "derived_bytes_required": true, "lifecycle": "superseded" },
    { "id": "tags", "provider_surface": "Tags and annotated-tag metadata", "public_visibility": "public", "anonymous_probe_required": true, "derived_bytes_required": true, "lifecycle": "superseded" },
    { "id": "pull-request-refs-cached-views-forks-clones", "provider_surface": "PR refs, cached views, forks, and known clones", "public_visibility": "public", "anonymous_probe_required": true, "derived_bytes_required": true, "lifecycle": "superseded" },
    { "id": "git-lfs", "provider_surface": "Git LFS pointers and objects", "public_visibility": "public", "anonymous_probe_required": true, "derived_bytes_required": true, "lifecycle": "superseded" },
    { "id": "submodules", "provider_surface": "Submodules and target commits", "public_visibility": "public", "anonymous_probe_required": true, "derived_bytes_required": true, "lifecycle": "superseded" },
    { "id": "releases-and-assets", "provider_surface": "Releases and release assets", "public_visibility": "public", "anonymous_probe_required": true, "derived_bytes_required": true, "lifecycle": "superseded" },
    { "id": "packages", "provider_surface": "Repository-linked packages and registries", "public_visibility": "public", "anonymous_probe_required": true, "derived_bytes_required": true, "lifecycle": "superseded" },
    { "id": "wiki", "provider_surface": "Wiki history and attachments", "public_visibility": "public", "anonymous_probe_required": true, "derived_bytes_required": true, "lifecycle": "superseded" },
    { "id": "issues", "provider_surface": "Issues, events, labels, milestones, comments, and attachments", "public_visibility": "public", "anonymous_probe_required": true, "derived_bytes_required": true, "lifecycle": "superseded" },
    { "id": "commit-comments", "provider_surface": "Commit comments and reactions", "public_visibility": "public", "anonymous_probe_required": true, "derived_bytes_required": true, "lifecycle": "superseded" },
    { "id": "pull-requests-reviews-comments-attachments", "provider_surface": "Pull requests, reviews, comments, checks, diffs, and attachments", "public_visibility": "public", "anonymous_probe_required": true, "derived_bytes_required": true, "lifecycle": "superseded" },
    { "id": "discussions", "provider_surface": "Discussions, answers, comments, edits, and attachments", "public_visibility": "public", "anonymous_probe_required": true, "derived_bytes_required": true, "lifecycle": "superseded" },
    { "id": "github-projects-visibility-and-content", "provider_surface": "Classic and Projects v2 visibility, fields, items, drafts, views, and linked content", "public_visibility": "public-metadata", "anonymous_probe_required": true, "derived_bytes_required": true, "lifecycle": "superseded" },
    { "id": "actions-workflow-definitions", "provider_surface": "Actions workflows, local/reusable actions, triggers, permissions, pins, and runners", "public_visibility": "public", "anonymous_probe_required": true, "derived_bytes_required": true, "lifecycle": "superseded" },
    { "id": "actions-runs-logs-summaries", "provider_surface": "Actions runs, jobs, logs, annotations, and summaries", "public_visibility": "public", "anonymous_probe_required": true, "derived_bytes_required": true, "lifecycle": "superseded" },
    { "id": "actions-artifacts", "provider_surface": "Actions artifacts and historical/expired metadata", "public_visibility": "public-metadata", "anonymous_probe_required": true, "derived_bytes_required": true, "lifecycle": "superseded" },
    { "id": "actions-caches", "provider_surface": "Actions caches and fork-access scope", "public_visibility": "authorization-sensitive", "anonymous_probe_required": false, "derived_bytes_required": true, "lifecycle": "superseded" },
    { "id": "actions-repository-variables", "provider_surface": "Repository Actions variables and selected values", "public_visibility": "authorization-sensitive", "anonymous_probe_required": false, "derived_bytes_required": false, "lifecycle": "superseded" },
    { "id": "actions-organization-variables-and-repository-access", "provider_surface": "Organization Actions variables, visibility, and selected-repository grants", "public_visibility": "authorization-sensitive", "anonymous_probe_required": false, "derived_bytes_required": false, "lifecycle": "superseded" },
    { "id": "actions-repository-secrets-and-authorization", "provider_surface": "Repository Actions secret metadata and workflow authorization scope", "public_visibility": "authorization-sensitive", "anonymous_probe_required": false, "derived_bytes_required": false, "lifecycle": "superseded" },
    { "id": "actions-organization-secrets-and-repository-access", "provider_surface": "Organization Actions secret metadata, visibility, and selected-repository grants", "public_visibility": "authorization-sensitive", "anonymous_probe_required": false, "derived_bytes_required": false, "lifecycle": "superseded" },
    { "id": "environments", "provider_surface": "Environments, protection, reviewers, variables, and secret metadata", "public_visibility": "authorization-sensitive", "anonymous_probe_required": false, "derived_bytes_required": false, "lifecycle": "superseded" },
    { "id": "deployments-and-statuses", "provider_surface": "Deployments and statuses", "public_visibility": "public-metadata", "anonymous_probe_required": true, "derived_bytes_required": true, "lifecycle": "superseded" },
    { "id": "pages-artifact-and-site", "provider_surface": "Pages artifact and served site", "public_visibility": "public", "anonymous_probe_required": true, "derived_bytes_required": true, "lifecycle": "superseded" },
    { "id": "pages-settings-domain-dns", "provider_surface": "Pages settings, custom domain, CNAME, HTTPS, and DNS", "public_visibility": "public-metadata", "anonymous_probe_required": true, "derived_bytes_required": true, "lifecycle": "superseded" },
    { "id": "repository-metadata-and-community-files", "provider_surface": "Repository metadata, community files, contributors, activity, stars, watchers, and fork network", "public_visibility": "public", "anonymous_probe_required": true, "derived_bytes_required": true, "lifecycle": "superseded" },
    { "id": "dependency-graph-and-external-snapshots", "provider_surface": "Dependency graph, manifests, submitted dependencies, and external dependency snapshots", "public_visibility": "authorization-sensitive", "anonymous_probe_required": false, "derived_bytes_required": true, "lifecycle": "superseded" },
    { "id": "artifact-attestations-and-public-transparency-log", "provider_surface": "Artifact attestations, subjects, predicates, signatures, and public Sigstore transparency-log records", "public_visibility": "public", "anonymous_probe_required": true, "derived_bytes_required": true, "lifecycle": "superseded" },
    { "id": "security-publications-and-alert-surfaces", "provider_surface": "Security policy, advisories, alerts, and annotations", "public_visibility": "authorization-sensitive", "anonymous_probe_required": true, "derived_bytes_required": true, "lifecycle": "superseded" },
    { "id": "webhooks-deploy-keys-collaborators-and-apps", "provider_surface": "Hooks, keys, collaborators, teams, apps, rulesets, protections, and token defaults", "public_visibility": "control-plane", "anonymous_probe_required": false, "derived_bytes_required": false, "lifecycle": "superseded" }
  ]
}
